{
  "schemaVersion": 1,
  "id": "cy-red-one-c",
  "revision": 1,
  "eraId": "discovery",
  "bars": 4,
  "key": {
    "tonic": "C",
    "mode": "major"
  },
  "harmony": [
    {
      "step": 0,
      "length": 16,
      "chord": "C"
    },
    {
      "step": 16,
      "length": 16,
      "chord": "Em"
    },
    {
      "step": 32,
      "length": 16,
      "chord": "Am"
    },
    {
      "step": 48,
      "length": 16,
      "chord": "Am"
    }
  ],
  "energy": 0.55,
  "tracks": {
    "lead": [
      {
        "type": "note",
        "step": 36,
        "length": 6,
        "pitch": "A4",
        "velocity": 1
      },
      {
        "type": "note",
        "step": 63,
        "length": 1,
        "pitch": "G4",
        "velocity": 1
      }
    ],
    "bass": [
      {
        "type": "note",
        "step": 21,
        "length": 1,
        "pitch": "F3",
        "velocity": 0.75
      },
      {
        "type": "note",
        "step": 22,
        "length": 1,
        "pitch": "G3",
        "velocity": 0.75
      },
      {
        "type": "note",
        "step": 23,
        "length": 1,
        "pitch": "B3",
        "velocity": 0.75
      }
    ],
    "arp": [
      {
        "type": "note",
        "step": 0,
        "length": 2,
        "pitch": "A4",
        "velocity": 1
      },
      {
        "type": "note",
        "step": 2,
        "length": 2,
        "pitch": "C5",
        "velocity": 1
      },
      {
        "type": "note",
        "step": 4,
        "length": 2,
        "pitch": "D5",
        "velocity": 1
      },
      {
        "type": "note",
        "step": 6,
        "length": 2,
        "pitch": "C5",
        "velocity": 1
      },
      {
        "type": "note",
        "step": 8,
        "length": 2,
        "pitch": "D5",
        "velocity": 1
      },
      {
        "type": "note",
        "step": 10,
        "length": 2,
        "pitch": "E5",
        "velocity": 1
      },
      {
        "type": "note",
        "step": 12,
        "length": 2,
        "pitch": "D5",
        "velocity": 1
      },
      {
        "type": "note",
        "step": 14,
        "length": 2,
        "pitch": "E5",
        "velocity": 1
      },
      {
        "type": "note",
        "step": 16,
        "length": 2,
        "pitch": "G5",
        "velocity": 1
      },
      {
        "type": "note",
        "step": 18,
        "length": 2,
        "pitch": "E5",
        "velocity": 1
      },
      {
        "type": "note",
        "step": 20,
        "length": 2,
        "pitch": "G5",
        "velocity": 1
      },
      {
        "type": "note",
        "step": 22,
        "length": 2,
        "pitch": "A5",
        "velocity": 1
      },
      {
        "type": "note",
        "step": 24,
        "length": 2,
        "pitch": "G5",
        "velocity": 1
      },
      {
        "type": "note",
        "step": 26,
        "length": 2,
        "pitch": "A5",
        "velocity": 1
      },
      {
        "type": "note",
        "step": 28,
        "length": 2,
        "pitch": "B5",
        "velocity": 1
      },
      {
        "type": "note",
        "step": 30,
        "length": 2,
        "pitch": "G5",
        "velocity": 1
      },
      {
        "type": "note",
        "step": 32,
        "length": 2,
        "pitch": "E4",
        "velocity": 1
      },
      {
        "type": "note",
        "step": 36,
        "length": 2,
        "pitch": "E4",
        "velocity": 1
      },
      {
        "type": "note",
        "step": 38,
        "length": 2,
        "pitch": "E4",
        "velocity": 1
      },
      {
        "type": "note",
        "step": 40,
        "length": 2,
        "pitch": "E4",
        "velocity": 1
      },
      {
        "type": "note",
        "step": 42,
        "length": 2,
        "pitch": "E4",
        "velocity": 1
      },
      {
        "type": "note",
        "step": 44,
        "length": 2,
        "pitch": "E4",
        "velocity": 1
      },
      {
        "type": "note",
        "step": 46,
        "length": 2,
        "pitch": "E4",
        "velocity": 1
      },
      {
        "type": "note",
        "step": 48,
        "length": 2,
        "pitch": "E4",
        "velocity": 1
      },
      {
        "type": "note",
        "step": 50,
        "length": 2,
        "pitch": "E4",
        "velocity": 1
      },
      {
        "type": "note",
        "step": 52,
        "length": 2,
        "pitch": "E4",
        "velocity": 1
      },
      {
        "type": "note",
        "step": 54,
        "length": 2,
        "pitch": "A4",
        "velocity": 1
      },
      {
        "type": "note",
        "step": 56,
        "length": 2,
        "pitch": "B4",
        "velocity": 1
      },
      {
        "type": "note",
        "step": 58,
        "length": 2,
        "pitch": "D5",
        "velocity": 1
      },
      {
        "type": "note",
        "step": 60,
        "length": 2,
        "pitch": "B4",
        "velocity": 1
      },
      {
        "type": "note",
        "step": 62,
        "length": 2,
        "pitch": "E4",
        "velocity": 1
      }
    ],
    "percussion": [
      {
        "type": "drum",
        "step": 0,
        "length": 1,
        "sound": "hat",
        "velocity": 0.45
      },
      {
        "type": "drum",
        "step": 4,
        "length": 1,
        "sound": "hat",
        "velocity": 0.45
      },
      {
        "type": "drum",
        "step": 8,
        "length": 1,
        "sound": "hat",
        "velocity": 0.45
      },
      {
        "type": "drum",
        "step": 12,
        "length": 1,
        "sound": "hat",
        "velocity": 0.45
      },
      {
        "type": "drum",
        "step": 16,
        "length": 1,
        "sound": "hat",
        "velocity": 0.45
      },
      {
        "type": "drum",
        "step": 19,
        "length": 1,
        "sound": "hat",
        "velocity": 0.45
      },
      {
        "type": "drum",
        "step": 20,
        "length": 1,
        "sound": "hat",
        "velocity": 0.45
      },
      {
        "type": "drum",
        "step": 24,
        "length": 1,
        "sound": "hat",
        "velocity": 0.45
      },
      {
        "type": "drum",
        "step": 28,
        "length": 1,
        "sound": "hat",
        "velocity": 0.45
      },
      {
        "type": "drum",
        "step": 32,
        "length": 1,
        "sound": "hat",
        "velocity": 0.45
      },
      {
        "type": "drum",
        "step": 32,
        "length": 1,
        "sound": "snare",
        "velocity": 0.9
      },
      {
        "type": "drum",
        "step": 34,
        "length": 1,
        "sound": "hat",
        "velocity": 0.45
      },
      {
        "type": "drum",
        "step": 34,
        "length": 1,
        "sound": "snare",
        "velocity": 0.9
      },
      {
        "type": "drum",
        "step": 35,
        "length": 1,
        "sound": "hat",
        "velocity": 0.45
      },
      {
        "type": "drum",
        "step": 36,
        "length": 1,
        "sound": "hat",
        "velocity": 0.45
      },
      {
        "type": "drum",
        "step": 40,
        "length": 1,
        "sound": "hat",
        "velocity": 0.45
      },
      {
        "type": "drum",
        "step": 44,
        "length": 1,
        "sound": "hat",
        "velocity": 0.45
      },
      {
        "type": "drum",
        "step": 48,
        "length": 1,
        "sound": "hat",
        "velocity": 0.45
      },
      {
        "type": "drum",
        "step": 51,
        "length": 1,
        "sound": "hat",
        "velocity": 0.45
      },
      {
        "type": "drum",
        "step": 52,
        "length": 1,
        "sound": "hat",
        "velocity": 0.45
      },
      {
        "type": "drum",
        "step": 56,
        "length": 1,
        "sound": "hat",
        "velocity": 0.45
      },
      {
        "type": "drum",
        "step": 60,
        "length": 1,
        "sound": "hat",
        "velocity": 0.45
      }
    ]
  },
  "boundary": {
    "entryGroup": "tonic",
    "exitGroup": "dominant"
  },
  "motifRef": {
    "id": "demo-main",
    "revision": 1
  },
  "license": "CC0-1.0",
  "attribution": "m0d — \"the-red-one\" (https://modarchive.org/index.php?request=view_by_moduleid&query=53326)",
  "demo": false,
  "metadata": {
    "description": "From m0d-the-red-one.mod, source bars 152–155. C major → C major; one source bar = one bar at the era tempo (source 125 bpm). Roles: lead = ch1, bass = ch2, arp = ch4. Mood: C major Amiga demo tune at 125 bpm, moderate density: bright and adventurous. Does not quote the motif (imported material).",
    "composer": "m0d (The Mod Archive, CC0); adapted by tools/music/importMidi.ts"
  }
}
