{
  "schemaVersion": 1,
  "id": "rpg-pavane-a",
  "revision": 1,
  "eraId": "singularity",
  "bars": 4,
  "key": {
    "tonic": "C",
    "mode": "phrygian"
  },
  "harmony": [
    {
      "step": 0,
      "length": 16,
      "chord": "Cm"
    },
    {
      "step": 16,
      "length": 16,
      "chord": "Cm"
    },
    {
      "step": 32,
      "length": 16,
      "chord": "Cm"
    },
    {
      "step": 48,
      "length": 16,
      "chord": "Bbm"
    }
  ],
  "energy": 0.31,
  "tracks": {
    "lead": [
      {
        "type": "note",
        "step": 32,
        "length": 6,
        "pitch": "C5",
        "velocity": 0.76
      },
      {
        "type": "note",
        "step": 38,
        "length": 2,
        "pitch": "Bb4",
        "velocity": 0.76
      },
      {
        "type": "note",
        "step": 40,
        "length": 4,
        "pitch": "A4",
        "velocity": 0.76
      },
      {
        "type": "note",
        "step": 44,
        "length": 4,
        "pitch": "G4",
        "velocity": 0.76
      },
      {
        "type": "note",
        "step": 48,
        "length": 8,
        "pitch": "Bb4",
        "velocity": 0.76
      },
      {
        "type": "note",
        "step": 56,
        "length": 4,
        "pitch": "Bb4",
        "velocity": 0.76
      },
      {
        "type": "note",
        "step": 60,
        "length": 4,
        "pitch": "A4",
        "velocity": 0.76
      }
    ],
    "arp": [
      {
        "type": "note",
        "step": 44,
        "length": 2,
        "pitch": "C4",
        "velocity": 0.55
      },
      {
        "type": "note",
        "step": 46,
        "length": 2,
        "pitch": "C5",
        "velocity": 0.55
      },
      {
        "type": "note",
        "step": 48,
        "length": 2,
        "pitch": "Db4",
        "velocity": 0.55
      },
      {
        "type": "note",
        "step": 50,
        "length": 2,
        "pitch": "Db5",
        "velocity": 0.55
      },
      {
        "type": "note",
        "step": 52,
        "length": 2,
        "pitch": "Db4",
        "velocity": 0.55
      },
      {
        "type": "note",
        "step": 54,
        "length": 2,
        "pitch": "Db5",
        "velocity": 0.55
      },
      {
        "type": "note",
        "step": 60,
        "length": 2,
        "pitch": "Db4",
        "velocity": 0.55
      },
      {
        "type": "note",
        "step": 62,
        "length": 2,
        "pitch": "Db5",
        "velocity": 0.55
      }
    ],
    "percussion": [
      {
        "type": "drum",
        "step": 0,
        "length": 1,
        "sound": "kick",
        "velocity": 0.57
      },
      {
        "type": "drum",
        "step": 8,
        "length": 1,
        "sound": "kick",
        "velocity": 0.57
      },
      {
        "type": "drum",
        "step": 12,
        "length": 1,
        "sound": "kick",
        "velocity": 0.57
      },
      {
        "type": "drum",
        "step": 16,
        "length": 1,
        "sound": "kick",
        "velocity": 0.57
      },
      {
        "type": "drum",
        "step": 24,
        "length": 1,
        "sound": "kick",
        "velocity": 0.57
      },
      {
        "type": "drum",
        "step": 28,
        "length": 1,
        "sound": "kick",
        "velocity": 0.57
      },
      {
        "type": "drum",
        "step": 32,
        "length": 1,
        "sound": "kick",
        "velocity": 0.57
      },
      {
        "type": "drum",
        "step": 40,
        "length": 1,
        "sound": "kick",
        "velocity": 0.57
      },
      {
        "type": "drum",
        "step": 44,
        "length": 1,
        "sound": "kick",
        "velocity": 0.57
      },
      {
        "type": "drum",
        "step": 48,
        "length": 1,
        "sound": "kick",
        "velocity": 0.57
      },
      {
        "type": "drum",
        "step": 56,
        "length": 1,
        "sound": "kick",
        "velocity": 0.57
      },
      {
        "type": "drum",
        "step": 60,
        "length": 1,
        "sound": "kick",
        "velocity": 0.57
      }
    ]
  },
  "boundary": {
    "entryGroup": "tonic",
    "exitGroup": "dominant"
  },
  "motifRef": {
    "id": "demo-main",
    "revision": 1
  },
  "license": "CC0-1.0",
  "attribution": "Aureolus_Omicron — \"15 Melodic RPG Chiptunes\" (https://opengameart.org/content/15-melodic-rpg-chiptunes)",
  "demo": false,
  "metadata": {
    "description": "From rpgchip05_pavane.mid, source bars 1–4. D minor → C phrygian; one source bar = one bar at the era tempo (source 108 bpm). Roles: lead = ch1, bass = ch5, arp = pads arpeggiated. Mood: D minor, sparse, purely modal (no chromatic notes): solemn, existential. Does not quote the motif (imported material).",
    "composer": "Aureolus_Omicron (OpenGameArt, CC0); adapted by tools/music/importMidi.ts"
  }
}
