{
  "schemaVersion": 1,
  "id": "rpg-evil-a",
  "revision": 1,
  "eraId": "self-improvement",
  "bars": 4,
  "key": {
    "tonic": "E",
    "mode": "minor"
  },
  "harmony": [
    {
      "step": 0,
      "length": 16,
      "chord": "Em"
    },
    {
      "step": 16,
      "length": 16,
      "chord": "Cm"
    },
    {
      "step": 32,
      "length": 16,
      "chord": "Dm"
    },
    {
      "step": 48,
      "length": 16,
      "chord": "Cm"
    }
  ],
  "energy": 0.51,
  "tracks": {
    "lead": [
      {
        "type": "note",
        "step": 20,
        "length": 6,
        "pitch": "C5",
        "velocity": 0.76
      },
      {
        "type": "note",
        "step": 28,
        "length": 2,
        "pitch": "D5",
        "velocity": 0.76
      },
      {
        "type": "note",
        "step": 30,
        "length": 2,
        "pitch": "D#5",
        "velocity": 0.76
      },
      {
        "type": "note",
        "step": 32,
        "length": 4,
        "pitch": "F5",
        "velocity": 0.76
      },
      {
        "type": "note",
        "step": 36,
        "length": 6,
        "pitch": "D5",
        "velocity": 0.76
      },
      {
        "type": "note",
        "step": 44,
        "length": 4,
        "pitch": "A4",
        "velocity": 0.76
      },
      {
        "type": "note",
        "step": 48,
        "length": 6,
        "pitch": "C5",
        "velocity": 0.76
      },
      {
        "type": "note",
        "step": 60,
        "length": 1,
        "pitch": "B4",
        "velocity": 0.76
      },
      {
        "type": "note",
        "step": 61,
        "length": 1,
        "pitch": "A#4",
        "velocity": 0.76
      },
      {
        "type": "note",
        "step": 62,
        "length": 1,
        "pitch": "A4",
        "velocity": 0.76
      },
      {
        "type": "note",
        "step": 63,
        "length": 1,
        "pitch": "G#4",
        "velocity": 0.76
      }
    ],
    "bass": [
      {
        "type": "note",
        "step": 0,
        "length": 16,
        "pitch": "E3",
        "velocity": 0.63
      },
      {
        "type": "note",
        "step": 16,
        "length": 4,
        "pitch": "D#3",
        "velocity": 0.63
      },
      {
        "type": "note",
        "step": 32,
        "length": 16,
        "pitch": "D3",
        "velocity": 0.63
      },
      {
        "type": "note",
        "step": 48,
        "length": 4,
        "pitch": "C3",
        "velocity": 0.63
      }
    ],
    "percussion": [
      {
        "type": "drum",
        "step": 0,
        "length": 1,
        "sound": "hat",
        "velocity": 0.57
      },
      {
        "type": "drum",
        "step": 2,
        "length": 1,
        "sound": "hat",
        "velocity": 0.57
      },
      {
        "type": "drum",
        "step": 4,
        "length": 1,
        "sound": "hat",
        "velocity": 0.57
      },
      {
        "type": "drum",
        "step": 6,
        "length": 1,
        "sound": "hat",
        "velocity": 0.57
      },
      {
        "type": "drum",
        "step": 8,
        "length": 1,
        "sound": "hat",
        "velocity": 0.57
      },
      {
        "type": "drum",
        "step": 10,
        "length": 1,
        "sound": "hat",
        "velocity": 0.57
      },
      {
        "type": "drum",
        "step": 12,
        "length": 1,
        "sound": "hat",
        "velocity": 0.57
      },
      {
        "type": "drum",
        "step": 14,
        "length": 1,
        "sound": "hat",
        "velocity": 0.57
      },
      {
        "type": "drum",
        "step": 16,
        "length": 1,
        "sound": "hat",
        "velocity": 0.57
      },
      {
        "type": "drum",
        "step": 18,
        "length": 1,
        "sound": "hat",
        "velocity": 0.57
      },
      {
        "type": "drum",
        "step": 20,
        "length": 1,
        "sound": "hat",
        "velocity": 0.57
      },
      {
        "type": "drum",
        "step": 20,
        "length": 1,
        "sound": "snare",
        "velocity": 0.57
      },
      {
        "type": "drum",
        "step": 22,
        "length": 1,
        "sound": "hat",
        "velocity": 0.57
      },
      {
        "type": "drum",
        "step": 24,
        "length": 1,
        "sound": "hat",
        "velocity": 0.57
      },
      {
        "type": "drum",
        "step": 24,
        "length": 1,
        "sound": "kick",
        "velocity": 0.57
      },
      {
        "type": "drum",
        "step": 26,
        "length": 1,
        "sound": "hat",
        "velocity": 0.57
      },
      {
        "type": "drum",
        "step": 28,
        "length": 1,
        "sound": "hat",
        "velocity": 0.57
      },
      {
        "type": "drum",
        "step": 30,
        "length": 1,
        "sound": "hat",
        "velocity": 0.57
      },
      {
        "type": "drum",
        "step": 32,
        "length": 1,
        "sound": "hat",
        "velocity": 0.57
      },
      {
        "type": "drum",
        "step": 34,
        "length": 1,
        "sound": "hat",
        "velocity": 0.57
      },
      {
        "type": "drum",
        "step": 36,
        "length": 1,
        "sound": "hat",
        "velocity": 0.57
      },
      {
        "type": "drum",
        "step": 38,
        "length": 1,
        "sound": "hat",
        "velocity": 0.57
      },
      {
        "type": "drum",
        "step": 40,
        "length": 1,
        "sound": "hat",
        "velocity": 0.57
      },
      {
        "type": "drum",
        "step": 42,
        "length": 1,
        "sound": "hat",
        "velocity": 0.57
      },
      {
        "type": "drum",
        "step": 44,
        "length": 1,
        "sound": "hat",
        "velocity": 0.57
      },
      {
        "type": "drum",
        "step": 46,
        "length": 1,
        "sound": "hat",
        "velocity": 0.57
      },
      {
        "type": "drum",
        "step": 48,
        "length": 1,
        "sound": "hat",
        "velocity": 0.57
      },
      {
        "type": "drum",
        "step": 50,
        "length": 1,
        "sound": "hat",
        "velocity": 0.57
      },
      {
        "type": "drum",
        "step": 52,
        "length": 1,
        "sound": "hat",
        "velocity": 0.57
      },
      {
        "type": "drum",
        "step": 52,
        "length": 1,
        "sound": "snare",
        "velocity": 0.57
      },
      {
        "type": "drum",
        "step": 54,
        "length": 1,
        "sound": "hat",
        "velocity": 0.57
      },
      {
        "type": "drum",
        "step": 56,
        "length": 1,
        "sound": "hat",
        "velocity": 0.57
      },
      {
        "type": "drum",
        "step": 56,
        "length": 1,
        "sound": "kick",
        "velocity": 0.57
      },
      {
        "type": "drum",
        "step": 58,
        "length": 1,
        "sound": "hat",
        "velocity": 0.57
      },
      {
        "type": "drum",
        "step": 60,
        "length": 1,
        "sound": "hat",
        "velocity": 0.57
      },
      {
        "type": "drum",
        "step": 60,
        "length": 1,
        "sound": "snare",
        "velocity": 0.57
      },
      {
        "type": "drum",
        "step": 62,
        "length": 1,
        "sound": "hat",
        "velocity": 0.57
      }
    ]
  },
  "boundary": {
    "entryGroup": "tonic",
    "exitGroup": "dominant"
  },
  "motifRef": {
    "id": "demo-main",
    "revision": 1
  },
  "license": "CC0-1.0",
  "attribution": "Aureolus_Omicron — \"15 Melodic RPG Chiptunes\" (https://opengameart.org/content/15-melodic-rpg-chiptunes)",
  "demo": false,
  "metadata": {
    "description": "From rpgchip12_the_evil_one.mid, source bars 9–12. E minor → E minor; one source bar = one bar at the era tempo (source 120 bpm). Roles: lead = ch1, bass = ch5, arp = ch2. Mood: E minor (the importer's reading; the profile alone says G minor): a bass sliding E–E♭–D–C, ominous and unstable. Does not quote the motif (imported material).",
    "composer": "Aureolus_Omicron (OpenGameArt, CC0); adapted by tools/music/importMidi.ts"
  }
}
