{
  "schemaVersion": 1,
  "id": "rpg-title-b",
  "revision": 1,
  "eraId": "discovery",
  "bars": 4,
  "key": {
    "tonic": "C",
    "mode": "major"
  },
  "harmony": [
    {
      "step": 0,
      "length": 16,
      "chord": "C"
    },
    {
      "step": 16,
      "length": 16,
      "chord": "F"
    },
    {
      "step": 32,
      "length": 16,
      "chord": "Dm"
    },
    {
      "step": 48,
      "length": 16,
      "chord": "G"
    }
  ],
  "energy": 0.58,
  "tracks": {
    "lead": [
      {
        "type": "note",
        "step": 0,
        "length": 9,
        "pitch": "C6",
        "velocity": 0.88
      },
      {
        "type": "note",
        "step": 10,
        "length": 2,
        "pitch": "D6",
        "velocity": 0.88
      },
      {
        "type": "note",
        "step": 12,
        "length": 2,
        "pitch": "C6",
        "velocity": 0.88
      },
      {
        "type": "note",
        "step": 14,
        "length": 2,
        "pitch": "B5",
        "velocity": 0.88
      },
      {
        "type": "note",
        "step": 16,
        "length": 9,
        "pitch": "A5",
        "velocity": 0.88
      },
      {
        "type": "note",
        "step": 26,
        "length": 2,
        "pitch": "A5",
        "velocity": 0.88
      },
      {
        "type": "note",
        "step": 28,
        "length": 2,
        "pitch": "B5",
        "velocity": 0.88
      },
      {
        "type": "note",
        "step": 30,
        "length": 2,
        "pitch": "C6",
        "velocity": 0.88
      },
      {
        "type": "note",
        "step": 32,
        "length": 8,
        "pitch": "D6",
        "velocity": 0.88
      },
      {
        "type": "note",
        "step": 40,
        "length": 8,
        "pitch": "A5",
        "velocity": 0.88
      },
      {
        "type": "note",
        "step": 48,
        "length": 8,
        "pitch": "B5",
        "velocity": 0.88
      },
      {
        "type": "note",
        "step": 56,
        "length": 8,
        "pitch": "D5",
        "velocity": 0.88
      }
    ],
    "bass": [
      {
        "type": "note",
        "step": 0,
        "length": 2,
        "pitch": "C3",
        "velocity": 0.5
      },
      {
        "type": "note",
        "step": 4,
        "length": 2,
        "pitch": "C3",
        "velocity": 0.5
      },
      {
        "type": "note",
        "step": 8,
        "length": 2,
        "pitch": "C3",
        "velocity": 0.5
      },
      {
        "type": "note",
        "step": 12,
        "length": 2,
        "pitch": "C3",
        "velocity": 0.5
      },
      {
        "type": "note",
        "step": 16,
        "length": 2,
        "pitch": "F3",
        "velocity": 0.5
      },
      {
        "type": "note",
        "step": 20,
        "length": 2,
        "pitch": "F3",
        "velocity": 0.5
      },
      {
        "type": "note",
        "step": 24,
        "length": 2,
        "pitch": "F3",
        "velocity": 0.5
      },
      {
        "type": "note",
        "step": 28,
        "length": 2,
        "pitch": "F3",
        "velocity": 0.5
      },
      {
        "type": "note",
        "step": 32,
        "length": 2,
        "pitch": "D3",
        "velocity": 0.5
      },
      {
        "type": "note",
        "step": 36,
        "length": 2,
        "pitch": "D3",
        "velocity": 0.5
      },
      {
        "type": "note",
        "step": 40,
        "length": 2,
        "pitch": "D3",
        "velocity": 0.5
      },
      {
        "type": "note",
        "step": 44,
        "length": 2,
        "pitch": "D3",
        "velocity": 0.5
      },
      {
        "type": "note",
        "step": 48,
        "length": 2,
        "pitch": "G3",
        "velocity": 0.5
      },
      {
        "type": "note",
        "step": 52,
        "length": 2,
        "pitch": "G3",
        "velocity": 0.5
      },
      {
        "type": "note",
        "step": 56,
        "length": 2,
        "pitch": "G3",
        "velocity": 0.5
      },
      {
        "type": "note",
        "step": 60,
        "length": 2,
        "pitch": "G3",
        "velocity": 0.5
      }
    ],
    "arp": [
      {
        "type": "note",
        "step": 0,
        "length": 2,
        "pitch": "E4",
        "velocity": 0.55
      },
      {
        "type": "note",
        "step": 4,
        "length": 2,
        "pitch": "E4",
        "velocity": 0.55
      },
      {
        "type": "note",
        "step": 8,
        "length": 2,
        "pitch": "E4",
        "velocity": 0.55
      },
      {
        "type": "note",
        "step": 12,
        "length": 2,
        "pitch": "E4",
        "velocity": 0.55
      },
      {
        "type": "note",
        "step": 16,
        "length": 2,
        "pitch": "E4",
        "velocity": 0.55
      },
      {
        "type": "note",
        "step": 20,
        "length": 2,
        "pitch": "E4",
        "velocity": 0.55
      },
      {
        "type": "note",
        "step": 24,
        "length": 2,
        "pitch": "E4",
        "velocity": 0.55
      },
      {
        "type": "note",
        "step": 28,
        "length": 2,
        "pitch": "E4",
        "velocity": 0.55
      },
      {
        "type": "note",
        "step": 32,
        "length": 2,
        "pitch": "F4",
        "velocity": 0.55
      },
      {
        "type": "note",
        "step": 36,
        "length": 2,
        "pitch": "F4",
        "velocity": 0.55
      },
      {
        "type": "note",
        "step": 40,
        "length": 2,
        "pitch": "F4",
        "velocity": 0.55
      },
      {
        "type": "note",
        "step": 44,
        "length": 2,
        "pitch": "F4",
        "velocity": 0.55
      },
      {
        "type": "note",
        "step": 48,
        "length": 2,
        "pitch": "F4",
        "velocity": 0.55
      },
      {
        "type": "note",
        "step": 52,
        "length": 2,
        "pitch": "F4",
        "velocity": 0.55
      },
      {
        "type": "note",
        "step": 56,
        "length": 2,
        "pitch": "F4",
        "velocity": 0.55
      },
      {
        "type": "note",
        "step": 60,
        "length": 2,
        "pitch": "F4",
        "velocity": 0.55
      }
    ],
    "percussion": [
      {
        "type": "drum",
        "step": 0,
        "length": 1,
        "sound": "kick",
        "velocity": 0.45
      },
      {
        "type": "drum",
        "step": 4,
        "length": 1,
        "sound": "hat",
        "velocity": 0.45
      },
      {
        "type": "drum",
        "step": 8,
        "length": 1,
        "sound": "snare",
        "velocity": 0.45
      },
      {
        "type": "drum",
        "step": 12,
        "length": 1,
        "sound": "hat",
        "velocity": 0.45
      },
      {
        "type": "drum",
        "step": 16,
        "length": 1,
        "sound": "kick",
        "velocity": 0.45
      },
      {
        "type": "drum",
        "step": 20,
        "length": 1,
        "sound": "hat",
        "velocity": 0.45
      },
      {
        "type": "drum",
        "step": 24,
        "length": 1,
        "sound": "snare",
        "velocity": 0.45
      },
      {
        "type": "drum",
        "step": 28,
        "length": 1,
        "sound": "hat",
        "velocity": 0.45
      },
      {
        "type": "drum",
        "step": 30,
        "length": 1,
        "sound": "kick",
        "velocity": 0.45
      },
      {
        "type": "drum",
        "step": 32,
        "length": 1,
        "sound": "hat",
        "velocity": 0.45
      },
      {
        "type": "drum",
        "step": 32,
        "length": 1,
        "sound": "kick",
        "velocity": 0.45
      },
      {
        "type": "drum",
        "step": 36,
        "length": 1,
        "sound": "hat",
        "velocity": 0.45
      },
      {
        "type": "drum",
        "step": 40,
        "length": 1,
        "sound": "snare",
        "velocity": 0.45
      },
      {
        "type": "drum",
        "step": 44,
        "length": 1,
        "sound": "hat",
        "velocity": 0.45
      },
      {
        "type": "drum",
        "step": 48,
        "length": 1,
        "sound": "kick",
        "velocity": 0.45
      },
      {
        "type": "drum",
        "step": 52,
        "length": 1,
        "sound": "hat",
        "velocity": 0.45
      },
      {
        "type": "drum",
        "step": 56,
        "length": 1,
        "sound": "snare",
        "velocity": 0.45
      },
      {
        "type": "drum",
        "step": 60,
        "length": 1,
        "sound": "hat",
        "velocity": 0.45
      }
    ]
  },
  "boundary": {
    "entryGroup": "tonic",
    "exitGroup": "dominant"
  },
  "motifRef": {
    "id": "demo-main",
    "revision": 1
  },
  "license": "CC0-1.0",
  "attribution": "Aureolus_Omicron — \"15 Melodic RPG Chiptunes\" (https://opengameart.org/content/15-melodic-rpg-chiptunes)",
  "demo": false,
  "metadata": {
    "description": "From rpgchip01_title_screen.mid, source bars 31–34. C major → C major; one source bar = one bar at the era tempo (source 180 bpm). Roles: lead = ch5, bass = ch4, arp = pads arpeggiated. Mood: C major, purely diatonic, bright square chords under a high lead: the cheerful start. Does not quote the motif (imported material).",
    "composer": "Aureolus_Omicron (OpenGameArt, CC0); adapted by tools/music/importMidi.ts"
  }
}
