{
  "schemaVersion": 1,
  "id": "rpg-town-c",
  "revision": 1,
  "eraId": "discovery",
  "bars": 4,
  "key": {
    "tonic": "C",
    "mode": "major"
  },
  "harmony": [
    {
      "step": 0,
      "length": 16,
      "chord": "C"
    },
    {
      "step": 16,
      "length": 16,
      "chord": "Dm"
    },
    {
      "step": 32,
      "length": 16,
      "chord": "D"
    },
    {
      "step": 48,
      "length": 16,
      "chord": "Gm"
    }
  ],
  "energy": 0.51,
  "tracks": {
    "lead": [
      {
        "type": "note",
        "step": 0,
        "length": 4,
        "pitch": "E5",
        "velocity": 0.76
      },
      {
        "type": "note",
        "step": 8,
        "length": 2,
        "pitch": "C5",
        "velocity": 0.76
      },
      {
        "type": "note",
        "step": 12,
        "length": 2,
        "pitch": "G4",
        "velocity": 0.76
      },
      {
        "type": "note",
        "step": 16,
        "length": 2,
        "pitch": "F4",
        "velocity": 0.76
      },
      {
        "type": "note",
        "step": 20,
        "length": 1,
        "pitch": "F4",
        "velocity": 0.76
      },
      {
        "type": "note",
        "step": 22,
        "length": 1,
        "pitch": "G4",
        "velocity": 0.76
      },
      {
        "type": "note",
        "step": 24,
        "length": 2,
        "pitch": "A4",
        "velocity": 0.76
      },
      {
        "type": "note",
        "step": 28,
        "length": 2,
        "pitch": "D5",
        "velocity": 0.76
      },
      {
        "type": "note",
        "step": 32,
        "length": 2,
        "pitch": "D5",
        "velocity": 0.76
      },
      {
        "type": "note",
        "step": 36,
        "length": 2,
        "pitch": "E5",
        "velocity": 0.76
      },
      {
        "type": "note",
        "step": 40,
        "length": 2,
        "pitch": "F#5",
        "velocity": 0.76
      },
      {
        "type": "note",
        "step": 44,
        "length": 2,
        "pitch": "D5",
        "velocity": 0.76
      },
      {
        "type": "note",
        "step": 48,
        "length": 2,
        "pitch": "D5",
        "velocity": 0.76
      },
      {
        "type": "note",
        "step": 52,
        "length": 1,
        "pitch": "D5",
        "velocity": 0.76
      },
      {
        "type": "note",
        "step": 54,
        "length": 1,
        "pitch": "Eb5",
        "velocity": 0.76
      },
      {
        "type": "note",
        "step": 56,
        "length": 2,
        "pitch": "F5",
        "velocity": 0.76
      },
      {
        "type": "note",
        "step": 60,
        "length": 2,
        "pitch": "G5",
        "velocity": 0.76
      }
    ],
    "bass": [
      {
        "type": "note",
        "step": 0,
        "length": 16,
        "pitch": "E2",
        "velocity": 0.63
      },
      {
        "type": "note",
        "step": 16,
        "length": 16,
        "pitch": "D2",
        "velocity": 0.63
      },
      {
        "type": "note",
        "step": 32,
        "length": 16,
        "pitch": "D2",
        "velocity": 0.63
      },
      {
        "type": "note",
        "step": 48,
        "length": 16,
        "pitch": "G2",
        "velocity": 0.63
      }
    ],
    "arp": [
      {
        "type": "note",
        "step": 0,
        "length": 4,
        "pitch": "G5",
        "velocity": 0.76
      },
      {
        "type": "note",
        "step": 8,
        "length": 4,
        "pitch": "E5",
        "velocity": 0.76
      },
      {
        "type": "note",
        "step": 20,
        "length": 1,
        "pitch": "D5",
        "velocity": 0.76
      },
      {
        "type": "note",
        "step": 22,
        "length": 1,
        "pitch": "E5",
        "velocity": 0.76
      },
      {
        "type": "note",
        "step": 24,
        "length": 2,
        "pitch": "F5",
        "velocity": 0.76
      },
      {
        "type": "note",
        "step": 28,
        "length": 2,
        "pitch": "A5",
        "velocity": 0.76
      },
      {
        "type": "note",
        "step": 32,
        "length": 2,
        "pitch": "F#5",
        "velocity": 0.76
      },
      {
        "type": "note",
        "step": 36,
        "length": 2,
        "pitch": "G5",
        "velocity": 0.76
      },
      {
        "type": "note",
        "step": 40,
        "length": 4,
        "pitch": "A5",
        "velocity": 0.76
      },
      {
        "type": "note",
        "step": 52,
        "length": 1,
        "pitch": "Bb4",
        "velocity": 0.76
      },
      {
        "type": "note",
        "step": 54,
        "length": 1,
        "pitch": "C5",
        "velocity": 0.76
      },
      {
        "type": "note",
        "step": 56,
        "length": 2,
        "pitch": "D5",
        "velocity": 0.76
      },
      {
        "type": "note",
        "step": 60,
        "length": 2,
        "pitch": "G5",
        "velocity": 0.76
      }
    ],
    "percussion": [
      {
        "type": "drum",
        "step": 0,
        "length": 1,
        "sound": "hat",
        "velocity": 0.57
      },
      {
        "type": "drum",
        "step": 4,
        "length": 1,
        "sound": "hat",
        "velocity": 0.57
      },
      {
        "type": "drum",
        "step": 8,
        "length": 1,
        "sound": "snare",
        "velocity": 0.57
      },
      {
        "type": "drum",
        "step": 12,
        "length": 1,
        "sound": "hat",
        "velocity": 0.57
      },
      {
        "type": "drum",
        "step": 16,
        "length": 1,
        "sound": "hat",
        "velocity": 0.57
      },
      {
        "type": "drum",
        "step": 16,
        "length": 1,
        "sound": "kick",
        "velocity": 0.57
      },
      {
        "type": "drum",
        "step": 20,
        "length": 1,
        "sound": "hat",
        "velocity": 0.57
      },
      {
        "type": "drum",
        "step": 24,
        "length": 1,
        "sound": "snare",
        "velocity": 0.57
      },
      {
        "type": "drum",
        "step": 28,
        "length": 1,
        "sound": "hat",
        "velocity": 0.57
      },
      {
        "type": "drum",
        "step": 32,
        "length": 1,
        "sound": "hat",
        "velocity": 0.57
      },
      {
        "type": "drum",
        "step": 36,
        "length": 1,
        "sound": "hat",
        "velocity": 0.57
      },
      {
        "type": "drum",
        "step": 40,
        "length": 1,
        "sound": "snare",
        "velocity": 0.57
      },
      {
        "type": "drum",
        "step": 44,
        "length": 1,
        "sound": "hat",
        "velocity": 0.57
      },
      {
        "type": "drum",
        "step": 48,
        "length": 1,
        "sound": "hat",
        "velocity": 0.57
      },
      {
        "type": "drum",
        "step": 48,
        "length": 1,
        "sound": "kick",
        "velocity": 0.57
      },
      {
        "type": "drum",
        "step": 52,
        "length": 1,
        "sound": "hat",
        "velocity": 0.57
      },
      {
        "type": "drum",
        "step": 56,
        "length": 1,
        "sound": "snare",
        "velocity": 0.57
      },
      {
        "type": "drum",
        "step": 60,
        "length": 1,
        "sound": "hat",
        "velocity": 0.57
      }
    ]
  },
  "boundary": {
    "entryGroup": "tonic",
    "exitGroup": "dominant"
  },
  "motifRef": {
    "id": "demo-main",
    "revision": 1
  },
  "license": "CC0-1.0",
  "attribution": "Aureolus_Omicron — \"15 Melodic RPG Chiptunes\" (https://opengameart.org/content/15-melodic-rpg-chiptunes)",
  "demo": false,
  "metadata": {
    "description": "From rpgchip03_town.mid, source bars 18–21. E major → C major; one source bar = one bar at the era tempo (source 108 bpm). Roles: lead = ch2, bass = ch5, arp = ch1. Mood: E major with a light mixolydian ♭7, two independent melodies over pads: friendly, adventurous. Does not quote the motif (imported material).",
    "composer": "Aureolus_Omicron (OpenGameArt, CC0); adapted by tools/music/importMidi.ts"
  }
}
